{
    "title": "Index JSON for Chimera Viral Alignment Databases",
    "schema_version": "1.1.0",
    "index_version": "1.1.1",
    "database_schema": "https://raw.githubusercontent.com/CLIMB-TRE/zeus/refs/heads/main/database_index_schema.json",
    "databases": [
        "viral_refseq"
    ],
    "database_descriptions": {
        "viral_refseq": "An index of viral RefSeq assemblies, originally used in the mSCAPE viral alignment database."
    },
    "data": {
        "viral_refseq": {
            "latest_version": "0.3.0",
            "latest_version_date": "2026-06-10",
            "versions": {
                "0.1.0": {
                    "date": "2025-10-20",
                    "description": "Initial release of the viral alignment database index.",
                    "methods_summary": "Database constructed from NCBI RefSeq viral genomes (on date 2025-09-29). Sequence taxa were matched to the NCBI taxonomy (version 2023-10-01). Database was constructed with 'https://raw.githubusercontent.com/CLIMB-TRE/zeus/refs/heads/main/database_creator.py'",
                    "taxonomy_version": "2023-10-01",
                    "fasta_uri": "s3://mscape-zeus-databases/viral_refseq/v0.1.0/viral_alignment_db_v010.fasta",
                    "fasta_md5": "bc0cee58861af463602eec870ce80d93",
                    "metadata_uri": "s3://mscape-zeus-databases/viral_refseq/v0.1.0/viral_alignment_db_v010_metadata.tsv",
                    "metadata_md5": "211fe13c8fe7f6f4177fad65089f70fc"
                },
                "0.2.0": {
                    "date": "2025-10-21",
                    "description": "Second release of viral alignment database index with minor updates. Specifically improved fuzzy matching algorithm for organism names.",
                    "methods_summary": "Database constructed from NCBI RefSeq viral genomes (on date 2025-09-29). Sequence taxa were matched to the NCBI taxonomy (version 2023-10-01). Database was constructed with 'https://raw.githubusercontent.com/CLIMB-TRE/zeus/refs/heads/main/database_creator.py'",
                    "taxonomy_version": "2023-10-01",
                    "fasta_uri": "s3://mscape-zeus-databases/viral_refseq/v0.2.0/viral_alignment_db_v020.fasta",
                    "fasta_md5": "8baa30db5097a0237fd0c90a14feaa97",
                    "metadata_uri": "s3://mscape-zeus-databases/viral_refseq/v0.2.0/viral_alignment_db_v020_metadata.tsv",
                    "metadata_md5": "396ae427123e1acea37faa3ee3c268f1"
                },
                "0.3.0": {
                    "date": "2026-06-10",
                    "description": "Third release of viral RefSeq database index with updated taxonomy, improved matching logic, also, added new segment metadata field for segmented viruses.",
                    "methods_summary": "Database constructed from NCBI RefSeq viral genomes (on date 2026-04-13). Sequence taxa were matched to the NCBI taxonomy (version 2026-06-01).",
                    "taxonomy_version": "2026-06-01",
                    "fasta_uri": "s3://mscape-zeus-databases/viral_refseq/v0.3.0/viral_alignment_db_v030.fasta",
                    "fasta_md5": "90bb66accce6bd7e3e084435af242c9f",
                    "metadata_uri": "s3://mscape-zeus-databases/viral_refseq/v0.3.0/viral_alignment_db_v030_metadata.tsv",
                    "metadata_md5": "85826b4b6a49486fe8c24962e4b969c2",
                    "mm2_index_uri": "s3://mscape-zeus-databases/viral_refseq/v0.3.0/viral_alignment_db_v030_minimap2_index.mm2",
                    "mm2_index_md5": "7d05febf313cbcd3ee5cb792e1fcd117",
                    "bwa_mem2_index_uri": "s3://mscape-zeus-databases/viral_refseq/v0.3.0/viral_alignment_db_v030_bwa_mem2_index.tar.gz",
                    "bwa_mem2_index_md5": "d2915aae13cacadf26612645e6046239"
                }
            }
        }
    }
}